{
  "$schema": "./site.config.schema.json",
  "site": {
    "origin": "https://drenazoirengimas.lt",
    "name": "drenazoirengimas.lt"
  },
  "contact": {
    "showPhone": false,
    "phone": "",
    "email": "marek.cernevic@gmail.com"
  },
  "privacy": {
    "controllerName": "LeadHub",
    "controllerAddress": "Vilnius, Lithuania"
  },
  "turnstile": {
    "siteKey": "0x4AAAAAAFdeiPmh4DYRUwzs"
  },
  "analytics": {
    "ga4Id": "",
    "cloudflareToken": "",
    "googleVerification": ""
  },
  "features": {
    "leadsEnabled": true,
    "indexingEnabled": true,
    "referrerAttribution": true
  },
  "email": {
    "from": "env:EMAIL_FROM",
    "to": "env:ADMIN_EMAIL",
    "replyTo": "env:BUSINESS_REPLY_TO"
  },
  "business": {
    "primaryCta": "Gauti pasiūlymą",
    "serviceAreas": [
      "Vilnius ir rajonas",
      "Kaunas ir rajonas",
      "Kitos Lietuvos vietovės"
    ],
    "heroArea": "Vilnius, Kaunas ir užklausos iš visos Lietuvos.",
    "footerArea": "Vilnius · Kaunas · Užklausos iš visos Lietuvos",
    "footerLines": [
      "Drenažas be spėlionių.",
      "Pirmiausia įvertinimas. Tada – sprendimas."
    ],
    "footerDescription": "Svetainė padeda pateikti užklausą nepriklausomam paslaugos teikėjui. Darbų galimybės ir sąlygos derinamos individualiai."
  }
}
